{"document_kind":"pricing_request","schema_version":1,"valuation_date":"2026-09-04","product":{"type":"european_vanilla","underlying_id":1,"currency_id":2,"expiry":"2027-09-04","strike":100.0,"notional":1.0,"side":{"type":"call"}},"market":{"type":"equity","currency_id":2,"underlying_id":1,"spot":100.0,"discount_curve":{"curve_id":10,"times":[0.0,1.0],"discount_factors":[1.0,0.95]},"dividend_curve":{"curve_id":11,"times":[0.0,1.0],"discount_factors":[1.0,0.98]}},"model":{"type":"black_scholes","volatility":0.2},"engine":{"type":"pseudo_monte_carlo","master_seed":7,"independent_sampling_units":1024,"variance_reduction":{"antithetic":true,"brownian_bridge":false}},"risk":{"delta":false,"vega":false,"smile_dynamics":{"type":"sticky_log_moneyness"}}}
